{
  "$schema": "https://json-schema.org/draft/2020-12/schema",
  "$id": "https://cuttoon-copilot.local/spec/preset.schema.json",
  "title": "Preset",
  "description": "프로젝트 단위 1회 확정값. 프로젝트 안에서 컷툰 생성 세션을 시작할 때 자동으로 주입되는 공통 스타일·정책 묶음이다. 필드 추가·유지 판정 기준: 프로젝트 내 모든 컷툰에 공통으로 주입되는 값만 여기 둔다. 컷툰마다 달라지는 값(등장 캐릭터, 서사 전개, 소재, 대사, 컷별 연출)은 preset이 아니라 storyboard 소유다. 등장 캐릭터 1~2명·주인공 1명 같은 제약도 세션 단위이므로 storyboard.schema.json에서 강제한다",
  "type": "object",
  "required": ["preset_version", "project_name", "assets", "style", "rules", "context"],
  "additionalProperties": false,
  "properties": {
    "preset_version": {
      "type": "string",
      "enum": ["1.1"],
      "description": "1.1에서 파괴적 변경: rules.characters 제거(세션 단위 값), project_name·context.industry·style.keywords 필수 추가"
    },
    "project_name": {
      "type": "string",
      "minLength": 1,
      "description": "프로젝트 표시 이름. 사용자가 온보딩에서 입력한다"
    },
    "assets": {
      "type": "object",
      "required": ["character_sheet", "style_refs", "reference_asset_ids"],
      "additionalProperties": false,
      "properties": {
        "character_sheet": {
          "type": "string",
          "pattern": "^asset://",
          "description": "필수. 프로젝트의 고정 마스코트 한 명을 3포즈로 그린 시트. 캐릭터 동일성은 텍스트 서술로 대체 불가 — 매 컷 reference 주입의 근거 애셋. issue #113에서 정합화: 이전 문구는 '캐릭터 풀'이었으나 storyboard.schema.json 의 cast[].character_id description(마스코트 한 명만 담고 나머지는 시트 없는 가변 인물)이 정본이고 구현도 1인 시트다. 여러 인물을 담는 확장은 character_pool 로 열어 뒀다"
        },
        "character_pool": {
          "type": "array",
          "items": { "type": "string", "pattern": "^asset://" },
          "uniqueItems": true,
          "description": "캐릭터 풀 확장용(issue #113 결정, #123). 지금은 항상 빈 배열 — 필드만 미리 박아 마이그레이션 회피(reference_asset_ids 와 같은 패턴). 프로젝트 설정 페이지에서 마스코트 외 인물을 추가할 수 있게 되면 여기가 채워진다. required 에 넣지 않는다 — 이미 저장된 프리셋이 깨진다"
        },
        "style_refs": {
          "type": "array",
          "items": { "type": "string", "pattern": "^asset://" },
          "uniqueItems": true,
          "description": "그림체 레퍼런스 업로드 애셋. 온보딩에서 스킵 가능 — 빈 배열이면 기본 스타일 적용"
        },
        "reference_asset_ids": {
          "type": "array",
          "items": { "type": "string" },
          "uniqueItems": true,
          "description": "누적 메모리용. 지금은 항상 빈 배열 — 필드만 미리 박아 마이그레이션 회피"
        },
        "font": {
          "type": "object",
          "required": ["family", "url", "kind"],
          "additionalProperties": false,
          "properties": {
            "family": { "type": "string", "minLength": 1, "maxLength": 60 },
            "url": { "type": "string", "pattern": "^https://", "maxLength": 2048 },
            "kind": { "type": "string", "enum": ["css", "file"] }
          }
        }
      }
    },
    "style": {
      "type": "object",
      "description": "그림체 확정값. 레퍼런스 이미지 추출값과 사용자가 직접 입력한 스타일 키워드를 합친 결과 — 레퍼런스 없이 키워드만으로도 성립한다",
      "required": [
        "keywords",
        "line_weight",
        "palette",
        "saturation",
        "character_ratio",
        "background_density",
        "bubble_style"
      ],
      "additionalProperties": false,
      "properties": {
        "keywords": {
          "type": "array",
          "items": { "type": "string" },
          "uniqueItems": true,
          "description": "사용자가 직접 입력하는 그림체 키워드. 단어 단위 태그 — enum 아님. 레퍼런스 업로드를 건너뛴 경우의 주 입력 경로이고, 업로드와 병행도 가능. 빈 배열이면 레퍼런스 추출값만 사용. forbidden·main_subjects와 동일하게 프롬프트 조립 시 미매핑 단어 위험 있음",
          "examples": [["수채화", "따뜻한", "손그림"]]
        },
        "keyword_hints": {
          "type": "array",
          "items": { "type": "string" },
          "description": "resolvePresetStyle이 만든 프롬프트용 영문 힌트. style.keywords 원본은 그대로 보존하고 여기에 저장한다 (#151·#125). 선택 필드 — 없으면 keywords 원본을 읽는다"
        },
        "line_weight": { "type": "string", "enum": ["thin", "medium", "thick"] },
        "palette": {
          "type": "array",
          "items": { "type": "string", "pattern": "^#[0-9A-Fa-f]{6}$" },
          "minItems": 1,
          "uniqueItems": true
        },
        "saturation": { "type": "string", "enum": ["pastel", "vivid", "muted"] },
        "character_ratio": {
          "type": "string",
          "enum": ["2head", "2.5head", "3head", "realistic"],
          "description": "캐릭터 두신 비율과 스타일을 하나로 묶은 선택지(의도적 결합) — 2~3두신 카툰 비율 또는 실사형"
        },
        "background_density": {
          "type": "string",
          "enum": ["none", "low", "medium", "high"],
          "description": "배경 단순화(협상 불가 고정값)를 스키마로 강제하는 필드"
        },
        "bubble_style": {
          "type": "string",
          "enum": ["rounded", "rect", "cloud"],
          "description": "vocabulary.json의 bubble_type과 동일한 값 집합 — 값 변경 시 두 파일을 함께 갱신"
        }
      }
    },
    "rules": {
      "type": "object",
      "description": "프로젝트 전체에 적용되는 정책. 컷툰마다 달라지는 값은 여기 두지 않는다 — 등장 캐릭터 명단·역할은 세션에서 정하므로 storyboard 소유",
      "required": ["forbidden", "cta_format"],
      "additionalProperties": false,
      "properties": {
        "forbidden": {
          "type": "array",
          "items": { "type": "string" },
          "uniqueItems": true,
          "description": "네거티브 요소. 단어 단위 태그 — enum 아님. 프롬프트 조립 시 미매핑 단어 위험 있음(정책 #15 확정, 프롬프트 경로 연결은 #125 OPEN)"
        },
        "forbidden_hints": {
          "type": "array",
          "items": { "type": "string" },
          "description": "resolvePresetStyle이 만든 프롬프트용 영문 힌트. rules.forbidden 원본은 그대로 보존하고 여기에 저장한다 (#151·#125). 선택 필드 — 없으면 forbidden 원본을 읽는다"
        },
        "cta_format": {
          "type": "string",
          "minLength": 1,
          "description": "마지막 컷 CTA의 프로젝트 기본값. 세션에서 다른 값으로 덮어쓸 수 있고, 덮어쓰지 않으면 이 값이 주입된다. spec/data/cta_presets.json에 정의된 preset 중 하나의 id를 저장한다 (예: 'consult_request'). 자유 문자열 타입은 유지하되(스키마 레벨 enum 아님), 값은 항상 cta_presets.json의 presets[].id 중 하나와 일치해야 한다 — presets 목록이 계속 늘어날 수 있어 JSON Schema enum으로 고정하지 않음 (issue #4)"
        },
        "cta_strength": {
          "type": "string",
          "enum": ["none", "soft", "clear"],
          "description": "프로젝트의 CTA 강도 기본값 (issue #205). none(이야기만)·soft(은근하게)·clear(확실하게). required에 넣지 않는다 — 없으면 clear로 해석해 기존 프리셋이 그대로 유효하다"
        }
      }
    },
    "context": {
      "type": "object",
      "description": "온보딩에서 수집하는 프로젝트 설정값. 각 필드는 빈 배열로 스킵 가능(assets/rules의 forbidden·style_refs와 동일한 규약)",
      "required": ["industry", "interests", "age_band", "life_stage", "main_subjects"],
      "additionalProperties": false,
      "properties": {
        "industry": {
          "type": "array",
          "items": { "type": "string" },
          "uniqueItems": true,
          "description": "이 프로젝트가 담당하는 분야. 회사가 무엇을 하는지에 해당한다. 단어 단위 태그 — enum 아님(값을 고정하면 특정 업종 분류가 스키마에 박혀 범용성이 깨진다)",
          "examples": [["카페"], ["헬스케어", "IT 솔루션"]]
        },
        "interests": {
          "type": "array",
          "uniqueItems": true,
          "items": {
            "type": "string",
            "enum": [
              "brand_awareness",
              "trust_building",
              "product_showcase",
              "sales_conversion",
              "event_promotion",
              "info_education",
              "lead_generation",
              "recruiting"
            ]
          },
          "description": "마케팅 목적 축(업종 무관, 목적만). 브랜드 인지도/신뢰형성/제품소개/구매전환/이벤트홍보/정보전달/문의확보/모집"
        },
        "age_band": {
          "type": "array",
          "uniqueItems": true,
          "items": {
            "type": "string",
            "enum": ["10s", "20s", "30s", "40s", "50s", "60s_plus"]
          },
          "description": "타깃층 — 연령대 축"
        },
        "life_stage": {
          "type": "array",
          "uniqueItems": true,
          "items": {
            "type": "string",
            "enum": ["student", "job_seeker", "early_career", "parent", "business_owner", "retired"]
          },
          "description": "타깃층 — 생활단계 축(연령대와 독립, 동시 선택 가능)"
        },
        "main_subjects": {
          "type": "array",
          "items": { "type": "string" },
          "uniqueItems": true,
          "description": "industry 안에서 이 프로젝트가 반복해 다루는 주제군(예: 카페라면 원두·디카페인·신메뉴). 컷툰 한 편의 실제 소재는 여기가 아니라 세션에서 받는다. 단어 단위 태그 — enum 아님. forbidden과 동일하게 프롬프트 조립 시 미매핑 단어 위험 있음"
        }
      }
    },
    "mascot": {
      "type": "object",
      "required": ["label", "description"],
      "additionalProperties": false,
      "description": "프로젝트 고정 마스코트(issue #150). 선택 필드 — 없으면 기존 동작(시트는 그림체 기준만, 컷 문구 그대로)을 유지한다. required에 넣지 않는다 — 이미 저장된 프리셋이 깨진다",
      "properties": {
        "label": {
          "type": "string",
          "minLength": 1,
          "description": "프로젝트에서 바뀌지 않는 cast ID(예: \"mascot\"). cast[].character_id에 들어갈 값"
        },
        "description": {
          "type": "string",
          "minLength": 1,
          "description": "시트·컷 프롬프트가 함께 쓰는 외형·역할 서술"
        }
      }
    }
  }
}
